scene,floor,question,choices,question_formatted,answer,label
00109-GTV2Y73Sn5t,0,I'm expecting a package that should have been left by the door. Is there a parcel on the bench by the entrance?,"['(Do not choose this option)', 'No', 'Yes', '(Do not choose this option)']",I'm expecting a package that should have been left by the door. Is there a parcel on the bench by the entrance? A) (Do not choose this option) B) No C) Yes D) (Do not choose this option). Answer:,B,location
00109-GTV2Y73Sn5t,1,I need to find my backpack for a trip. Where did I place it?,"['In the bedroom with the futon', 'In the bedroom with the wooden bed', 'In the office with the large desk', 'Near the upstairs railing']",I need to find my backpack for a trip. Where did I place it? A) In the bedroom with the futon B) In the bedroom with the wooden bed C) In the office with the large desk D) Near the upstairs railing. Answer:,A,existence
00109-GTV2Y73Sn5t,1,Is my son sleeping on his red bed?,"['(Do not choose this option)', '(Do not choose this option)', 'Yes', 'No']",Is my son sleeping on his red bed? A) (Do not choose this option) B) (Do not choose this option) C) Yes D) No. Answer:,D,existence
00127-EN7GiDgxdQ2,0,Where did I put a stacks of books?,"['On the sofa', 'On the coffee table', 'Next to TV', 'Next to the armchair']",Where did I put a stacks of books? A) On the sofa B) On the coffee table C) Next to TV D) Next to the armchair. Answer:,D,identification
00130-MjzBosUX3WW,0,Are the mirror lights in the bathroom on?,"['No', '(Do not choose this option)', 'Yes', '(Do not choose this option)']",Are the mirror lights in the bathroom on? A) No B) (Do not choose this option) C) Yes D) (Do not choose this option). Answer:,C,location
00135-HeSYRw7eMtG,1,What time is it now?,"['1-3pm', '7-9am', '10-12pm', '5-7pm']",What time is it now? A) 1-3pm B) 7-9am C) 10-12pm D) 5-7pm. Answer:,A,existence
00135-HeSYRw7eMtG,1,I forgot where I left the standing fan.,"['Next to the armchair', 'Next to kitchen', 'In the bathroom', 'In the bedroom']",I forgot where I left the standing fan. A) Next to the armchair B) Next to kitchen C) In the bathroom D) In the bedroom. Answer:,A,location
00135-HeSYRw7eMtG,2,How many table lamps are there in the bedroom?,"['Three', 'Four', 'One', 'Two']",How many table lamps are there in the bedroom? A) Three B) Four C) One D) Two. Answer:,D,state
00148-csHQLLFPE3g,0,I need to find the large gray trash can. Where is it now?,"['In the storage room', 'In the bedroom', 'In the living room', 'Near the dining area']",I need to find the large gray trash can. Where is it now? A) In the storage room B) In the bedroom C) In the living room D) Near the dining area. Answer:,A,location
00148-csHQLLFPE3g,0,How many sets of utensils are already set up on the dining table?,"['Two', 'Six', 'None', 'Four']",How many sets of utensils are already set up on the dining table? A) Two B) Six C) None D) Four. Answer:,C,count
00149-UuwwmrTsfBN,1,I am waiting for the guests. Have I put utensils on the dining table?,"['No', '(Do not choose this option)', 'Yes', '(Do not choose this option)']",I am waiting for the guests. Have I put utensils on the dining table? A) No B) (Do not choose this option) C) Yes D) (Do not choose this option). Answer:,A,existence
00149-UuwwmrTsfBN,1,Is the patio door next to the dining table open?,"['(Do not choose this option)', '(Do not choose this option)', 'Yes', 'No']",Is the patio door next to the dining table open? A) (Do not choose this option) B) (Do not choose this option) C) Yes D) No. Answer:,D,location
00151-D8bT1ambLFc,0,I need to retrieve my exercise ball. Where did I leave it last?,"['In the bedroom', 'In the kitchen', 'In the living room', 'In the home office area']",I need to retrieve my exercise ball. Where did I leave it last? A) In the bedroom B) In the kitchen C) In the living room D) In the home office area. Answer:,D,location
00151-D8bT1ambLFc,0,I am trying to find my white suitcase.,"['It is on the bedroom floor', 'It is in the bedroom storage', 'It is next to TV', 'It is in the hallway']",I am trying to find my white suitcase. A) It is on the bedroom floor B) It is in the bedroom storage C) It is next to TV D) It is in the hallway. Answer:,B,state
00154-2dZ1Jivh5if,0,How many bar stools are placed at the kitchen counter?,"['Two', 'None', 'Three', 'Four']",How many bar stools are placed at the kitchen counter? A) Two B) None C) Three D) Four. Answer:,A,state
00154-2dZ1Jivh5if,0,Do you see the small red stool anywhere?,"['It is next to the bookcase', 'It is at the corner of kitchen', 'It is in the bedroom', 'It is in the bathroom']",Do you see the small red stool anywhere? A) It is next to the bookcase B) It is at the corner of kitchen C) It is in the bedroom D) It is in the bathroom. Answer:,A,location
00155-iLDo95ZbDJq,0,"Is the bedroom closet open or closed, the bedroom with horse painting?","['It is closed', 'It is open', '(Do not choose this option)', '(Do not choose this option)']","Is the bedroom closet open or closed, the bedroom with horse painting? A) It is closed B) It is open C) (Do not choose this option) D) (Do not choose this option). Answer:",A,count
00158-YV9M9gZG3YJ,0,I'm trying to remember where I placed the plush giraffe toy. Where is it?,"['On the hallway console', ""On the shelf in the child's room"", 'On the bed in one of the bedrooms', 'On the bathroom counter']",I'm trying to remember where I placed the plush giraffe toy. Where is it? A) On the hallway console B) On the shelf in the child's room C) On the bed in one of the bedrooms D) On the bathroom counter. Answer:,C,location
00158-YV9M9gZG3YJ,0,"Did I turn off the bed lamps in the main bedroom, the one with red pillows?","['They are on', '(Do not choose this option)', '(Do not choose this option)', 'They are off']","Did I turn off the bed lamps in the main bedroom, the one with red pillows? A) They are on B) (Do not choose this option) C) (Do not choose this option) D) They are off. Answer:",D,existence
00159-DfUQLukPMPc,0,I'm trying to remember where I placed the table tennis paddles. Are they on or near the ping pong table?,"['They are not visible near the ping pong table', 'Under the ping pong table', 'Next to the ping pong table on the floor', 'On the ping pong table']",I'm trying to remember where I placed the table tennis paddles. Are they on or near the ping pong table? A) They are not visible near the ping pong table B) Under the ping pong table C) Next to the ping pong table on the floor D) On the ping pong table. Answer:,D,location
00159-DfUQLukPMPc,0,How many bar stools we have in the basement?,"['Two', 'Three', 'One', 'Four']",How many bar stools we have in the basement? A) Two B) Three C) One D) Four. Answer:,A,location
00161-uFCiZVVks57,0,I'm trying to remember how many plates I put on the dining table.,"['Four', 'Eight', 'Twelve', 'None']",I'm trying to remember how many plates I put on the dining table. A) Four B) Eight C) Twelve D) None. Answer:,B,count
00161-uFCiZVVks57,0,I need to find the orange chair. Where is it?,"['In the bedroom with the patterned wallpaper', 'In the hallway', 'In the dining area', 'In the bedroom with the fireplace']",I need to find the orange chair. Where is it? A) In the bedroom with the patterned wallpaper B) In the hallway C) In the dining area D) In the bedroom with the fireplace. Answer:,D,location
00166-RaYrxWt5pR1,0,I'm trying to remember how many bar stools are at the kitchen island.,"['Three', 'Five', 'Four', 'Two']",I'm trying to remember how many bar stools are at the kitchen island. A) Three B) Five C) Four D) Two. Answer:,D,state
00166-RaYrxWt5pR1,0,I'm looking for my laptop. It is on the bedroom dresser?,"['It is there', '(Do not choose this option)', '(Do not choose this option)', 'It is not there']",I'm looking for my laptop. It is on the bedroom dresser? A) It is there B) (Do not choose this option) C) (Do not choose this option) D) It is not there. Answer:,D,location
00167-yogvKWUrdnw,0,I'm trying to remember where I placed the large wall clock. Where is it?,"['In the dining area', 'In the kitchen', 'In the sunroom', 'In the living area near the fireplace']",I'm trying to remember where I placed the large wall clock. Where is it? A) In the dining area B) In the kitchen C) In the sunroom D) In the living area near the fireplace. Answer:,D,state
00167-yogvKWUrdnw,0,I'm looking for the fruit bowl.,"['On the kitchen island', 'On the dining table', 'On the coffee table', 'In the sunroom']",I'm looking for the fruit bowl. A) On the kitchen island B) On the dining table C) On the coffee table D) In the sunroom. Answer:,A,location
00167-yogvKWUrdnw,1,I'm looking for the black towel. Is it in the bathroom?,"['(Do not choose this option)', '(Do not choose this option)', 'Yes', 'No']",I'm looking for the black towel. Is it in the bathroom? A) (Do not choose this option) B) (Do not choose this option) C) Yes D) No. Answer:,D,count
00170-S3r45BMWy6H,0,Is the ironing board set up in the room with the checkered floor?,"['No', '(Do not choose this option)', 'Yes', '(Do not choose this option)']",Is the ironing board set up in the room with the checkered floor? A) No B) (Do not choose this option) C) Yes D) (Do not choose this option). Answer:,A,count
00170-S3r45BMWy6H,0,How many chairs are around the dining table in the room with the wooden floor and a red rug?,"['Six', 'Four', 'Eight', 'Two']",How many chairs are around the dining table in the room with the wooden floor and a red rug? A) Six B) Four C) Eight D) Two. Answer:,A,count
00171-mWqBmEyXcXN,1,I need to find light blue pillow. Where is it currently located?,"['In the bedroom', 'In the bathroom', 'In the hallway', 'In the home office space']",I need to find light blue pillow. Where is it currently located? A) In the bedroom B) In the bathroom C) In the hallway D) In the home office space. Answer:,A,existence
00171-mWqBmEyXcXN,1,How many of the shelves on the two bookshelves are completely empty?,"['One', 'None', 'Four', 'Two']",How many of the shelves on the two bookshelves are completely empty? A) One B) None C) Four D) Two. Answer:,B,location
00176-wcJYziD5pmF,0,I need to find the white woven basket. Where is it right now?,"['Next to the bedroom nightstand', 'On the dining table', 'On the kitchen countertop', 'Near the living area sofa']",I need to find the white woven basket. Where is it right now? A) Next to the bedroom nightstand B) On the dining table C) On the kitchen countertop D) Near the living area sofa. Answer:,A,location
00176-wcJYziD5pmF,0,I'm looking for the banjo that I usually keep around.,"['Resting in the living area', 'On the bedroom wall', 'Hanging in the hallway', 'Leaning against the kitchen cabinets']",I'm looking for the banjo that I usually keep around. A) Resting in the living area B) On the bedroom wall C) Hanging in the hallway D) Leaning against the kitchen cabinets. Answer:,B,existence
00176-wcJYziD5pmF,2,I remember leaving the panama hat somewhere.,"['It is on top of the bedroom door', 'It is on one of the beds', 'It is on one of the armchairs', 'It is in one of the bedroom closets']",I remember leaving the panama hat somewhere. A) It is on top of the bedroom door B) It is on one of the beds C) It is on one of the armchairs D) It is in one of the bedroom closets. Answer:,A,existence
00178-yqNxxJnA3iL,1,Is the green curtain in the bedroom closed?,"['(Do not choose this option)', '(Do not choose this option)', 'No, it is open', 'Yes, it is closed']","Is the green curtain in the bedroom closed? A) (Do not choose this option) B) (Do not choose this option) C) No, it is open D) Yes, it is closed. Answer:",C,count
00181-qkkRnWghK8e,0,I'm trying to remember where I placed the fruit bowl.,"['On the living room coffee table', 'On the bedroom dresser', 'On the kitchen counter', 'On the dining room table']",I'm trying to remember where I placed the fruit bowl. A) On the living room coffee table B) On the bedroom dresser C) On the kitchen counter D) On the dining room table. Answer:,D,location
00185-NjyeoK5BLx3,0,Are the bar stools tucked under the kitchen island?,"['No', 'Yes', '(Do not choose this option)', '(Do not choose this option)']",Are the bar stools tucked under the kitchen island? A) No B) Yes C) (Do not choose this option) D) (Do not choose this option). Answer:,B,location
00186-7UdY7HiDnUi,0,I seem to have misplaced my colorful throw pillows. Where are they currently located?,"['On the dining chairs', 'On the sofa', 'On the bed', 'In the hallway']",I seem to have misplaced my colorful throw pillows. Where are they currently located? A) On the dining chairs B) On the sofa C) On the bed D) In the hallway. Answer:,B,location
00187-GCCrNuhZ9WY,0,I'm expecting guests and need to check if the guest room is ready. Is the red pillow on the bed?,"['(Do not choose this option)', 'No', '(Do not choose this option)', 'Yes']",I'm expecting guests and need to check if the guest room is ready. Is the red pillow on the bed? A) (Do not choose this option) B) No C) (Do not choose this option) D) Yes. Answer:,D,location
00187-GCCrNuhZ9WY,0,Where did I put the woven brown rug?,"['Kitchen entrance', 'Bathroom entrance', 'Living room entrance', 'Bedroom entrance']",Where did I put the woven brown rug? A) Kitchen entrance B) Bathroom entrance C) Living room entrance D) Bedroom entrance. Answer:,D,state
00193-wwX4MFiTTrt,0,Did I put the fruit bar on the kitchen island?,"['No, not yet', '(Do not choose this option)', '(Do not choose this option)', 'Yes, you did']","Did I put the fruit bar on the kitchen island? A) No, not yet B) (Do not choose this option) C) (Do not choose this option) D) Yes, you did. Answer:",A,location
00193-wwX4MFiTTrt,1,I need to retrieve a painting from storage. Which one is placed on the left top of the wooden dresser near the staircase?,"['A landscape painting', 'An abstract painting', 'A portrait of a person', ""A painting of a Buddha's face""]",I need to retrieve a painting from storage. Which one is placed on the left top of the wooden dresser near the staircase? A) A landscape painting B) An abstract painting C) A portrait of a person D) A painting of a Buddha's face. Answer:,D,state
00202-yVbpFay8gTU,0,I'm trying to remember where I placed the decorative vase with branches.,"['On the coffee table in the living room', 'On the kitchen counter', 'On the dining table', 'On the sideboard in the hallway']",I'm trying to remember where I placed the decorative vase with branches. A) On the coffee table in the living room B) On the kitchen counter C) On the dining table D) On the sideboard in the hallway. Answer:,D,location
00202-yVbpFay8gTU,0,I'm expecting guests and need to set the table. How many chairs are missing around the dining table?,"['Four', 'Six', 'Two', 'None']",I'm expecting guests and need to set the table. How many chairs are missing around the dining table? A) Four B) Six C) Two D) None. Answer:,C,existence
00202-yVbpFay8gTU,1,I want to shower now. Are there towels on the bathtub?,"['No, there is none', 'Yes, there are', '(Do not choose this option)', '(Do not choose this option)']","I want to shower now. Are there towels on the bathtub? A) No, there is none B) Yes, there are C) (Do not choose this option) D) (Do not choose this option). Answer:",B,location
00202-yVbpFay8gTU,1,Did I put away the teepee or is it still on the bedroom floor?,"['(Do not choose this option)', 'It is still there', '(Do not choose this option)', 'It is not seen anywhere any more']",Did I put away the teepee or is it still on the bedroom floor? A) (Do not choose this option) B) It is still there C) (Do not choose this option) D) It is not seen anywhere any more. Answer:,B,existence
00203-VoVGtfYrpuQ,0,I'm trying to remember where I placed the decorative wooden bowl. Is it on the dining table?,"['No', '(Do not choose this option)', 'Yes', '(Do not choose this option)']",I'm trying to remember where I placed the decorative wooden bowl. Is it on the dining table? A) No B) (Do not choose this option) C) Yes D) (Do not choose this option). Answer:,C,identification
00203-VoVGtfYrpuQ,0,Is the air conditioning unit in the dining area still on?,"['(Do not choose this option)', ""Yes, it's on"", '(Do not choose this option)', ""No, it's not on""]","Is the air conditioning unit in the dining area still on? A) (Do not choose this option) B) Yes, it's on C) (Do not choose this option) D) No, it's not on. Answer:",D,location
00204-gxttMtT5ZGK,0,I need to find my framed collection of dollar bills. Where did I leave it?,"['On top of the storage shelves', 'On the workbench', 'Inside the glass cabinet', 'Leaning against the wall on the floor']",I need to find my framed collection of dollar bills. Where did I leave it? A) On top of the storage shelves B) On the workbench C) Inside the glass cabinet D) Leaning against the wall on the floor. Answer:,D,count
00204-gxttMtT5ZGK,0,I'm trying to remember where I placed the skeleton decoration after last Halloween. Can you locate it for me?,"['On the workbench', 'Near the entrance door', 'In the corner of the room', 'On top of the storage shelves']",I'm trying to remember where I placed the skeleton decoration after last Halloween. Can you locate it for me? A) On the workbench B) Near the entrance door C) In the corner of the room D) On top of the storage shelves. Answer:,D,existence
00204-gxttMtT5ZGK,1,Did I Ieave anything on the bench near the front entrance?,"['A hat', 'Nothing', 'A jacket', 'A package']",Did I Ieave anything on the bench near the front entrance? A) A hat B) Nothing C) A jacket D) A package. Answer:,B,state
00204-gxttMtT5ZGK,1,Is my backpack on the kitchen island?,"['(Do not choose this option)', 'Yes', 'No', '(Do not choose this option)']",Is my backpack on the kitchen island? A) (Do not choose this option) B) Yes C) No D) (Do not choose this option). Answer:,C,existence
00204-gxttMtT5ZGK,2,Where is the floor lamp?,"['In the bathroom', 'Next to the armchair', 'Next to the TV', 'Next to the dining table']",Where is the floor lamp? A) In the bathroom B) Next to the armchair C) Next to the TV D) Next to the dining table. Answer:,B,state
00204-gxttMtT5ZGK,2,"How many white pillows are on the bed with the ""Sweetpea"" wall decoration?","['Four', 'Two', 'Three', 'One']","How many white pillows are on the bed with the ""Sweetpea"" wall decoration? A) Four B) Two C) Three D) One. Answer:",D,location
00207-FRQ75PjD278,0,I need to find my large red storage bag. Where did I put it last?,"['On top of the bedroom closet', 'Next to the kitchen closet', 'In the bathroom', 'Near the living room window']",I need to find my large red storage bag. Where did I put it last? A) On top of the bedroom closet B) Next to the kitchen closet C) In the bathroom D) Near the living room window. Answer:,A,location
00208-SQqGpSHzfSr,0,I'm expecting a package to be delivered and left by the entrance. Is there a small parcel near the front door?,"['(Do not choose this option)', 'Yes, there is a parcel.', 'No, there is no parcel.', '(Do not choose this option)']","I'm expecting a package to be delivered and left by the entrance. Is there a small parcel near the front door? A) (Do not choose this option) B) Yes, there is a parcel. C) No, there is no parcel. D) (Do not choose this option). Answer:",C,existence
00213-mkvHBa3mEEk,1,Where did I put the blue teapot?,"['On the coffee table', 'On the kitchen island', 'On the kitchen countertop', 'On the stove']",Where did I put the blue teapot? A) On the coffee table B) On the kitchen island C) On the kitchen countertop D) On the stove. Answer:,C,location
00217-qz3829g1Lzf,0,Did I leave any pot on the stove?,"['Two', 'None', 'Three', 'One']",Did I leave any pot on the stove? A) Two B) None C) Three D) One. Answer:,B,count
00217-qz3829g1Lzf,0,How many wooden chairs we have at the dining table right now?,"['Four', 'Eight', 'Six', 'Two']",How many wooden chairs we have at the dining table right now? A) Four B) Eight C) Six D) Two. Answer:,C,location
00217-qz3829g1Lzf,1,I need to find two gray bags with beddings. Is it in the room with the wooden dresser and the quilted bedspread?,"['No', 'Yes', '(Do not choose this option)', '(Do not choose this option)']",I need to find two gray bags with beddings. Is it in the room with the wooden dresser and the quilted bedspread? A) No B) Yes C) (Do not choose this option) D) (Do not choose this option). Answer:,A,existence
00218-fQHGxvurx9L,0,Where is the roomba?,"['In the bedroom', 'Near the front door', 'Next to TV', 'In the dining area']",Where is the roomba? A) In the bedroom B) Near the front door C) Next to TV D) In the dining area. Answer:,D,location
00218-fQHGxvurx9L,0,I forgot if there is any drawer under the bed with light-colored bedding.,"['There are drawers', '(Do not choose this option)', 'There is none', '(Do not choose this option)']",I forgot if there is any drawer under the bed with light-colored bedding. A) There are drawers B) (Do not choose this option) C) There is none D) (Do not choose this option). Answer:,A,existence
00224-8m2Sk2sC3DR,0,I remember lefting something on the bedroom bench. What is it?,"['A tray with a mug and other things', 'A fruit bowl with pears', 'A soccer ball with white stripes', 'A jacket with black stitches']",I remember lefting something on the bedroom bench. What is it? A) A tray with a mug and other things B) A fruit bowl with pears C) A soccer ball with white stripes D) A jacket with black stitches. Answer:,A,existence
00224-8m2Sk2sC3DR,1,I'm looking for the white woven ottoman. Where it is?,"['In the hallway next to dresser', 'In the bathroom', 'In the bedroom', 'Next to the coffee tabel']",I'm looking for the white woven ottoman. Where it is? A) In the hallway next to dresser B) In the bathroom C) In the bedroom D) Next to the coffee tabel. Answer:,D,location
00224-8m2Sk2sC3DR,1,Is the balcony door in the main bedroom closed?,"['No, the door is open', 'Yes, it is closed', '(Do not choose this option)', '(Do not choose this option)']","Is the balcony door in the main bedroom closed? A) No, the door is open B) Yes, it is closed C) (Do not choose this option) D) (Do not choose this option). Answer:",B,existence
00226-8mXffaQTtmP,0,Which towel is there in the kitchen?,"['Green', 'White', 'Black', 'Red']",Which towel is there in the kitchen? A) Green B) White C) Black D) Red. Answer:,A,identification
00227-bvdRzJBgJyg,0,Are the boots near the front door?,"['No', '(Do not choose this option)', 'Yes', '(Do not choose this option)']",Are the boots near the front door? A) No B) (Do not choose this option) C) Yes D) (Do not choose this option). Answer:,A,location
00227-bvdRzJBgJyg,0,Is the lamp under the wall mirror on?,"['No, it is off', '(Do not choose this option)', 'Yes, it is on', '(Do not choose this option)']","Is the lamp under the wall mirror on? A) No, it is off B) (Do not choose this option) C) Yes, it is on D) (Do not choose this option). Answer:",A,state
00227-bvdRzJBgJyg,1,Which rug is in the bathroom?,"['Yellow one', 'Green one', 'White one', 'Blue one']",Which rug is in the bathroom? A) Yellow one B) Green one C) White one D) Blue one. Answer:,A,identification
00228-d5faFfQRphr,0,Is the television in the main bedroom turned off?,"['(Do not choose this option)', '(Do not choose this option)', 'No, it is on', 'Yes, it is off']","Is the television in the main bedroom turned off? A) (Do not choose this option) B) (Do not choose this option) C) No, it is on D) Yes, it is off. Answer:",D,existence
00231-4h4JxvG3cip,0,"Did I leave a pillow under the poster, on the chair I think?","['Yes, it is blue', 'Yes, it is white', 'Yes, it is yellow', 'No, there is none']","Did I leave a pillow under the poster, on the chair I think? A) Yes, it is blue B) Yes, it is white C) Yes, it is yellow D) No, there is none. Answer:",A,identification
00240-q9CAdKfvar2,1,How many red chairs are there around the dining table?,"['Three', 'Four', 'Two', 'Five']",How many red chairs are there around the dining table? A) Three B) Four C) Two D) Five. Answer:,B,state
00245-741Fdj7NLF9,0,I was playing darts last night and can't recall where I left the board.,"['It is in the bedroom', 'It is in the dining room', 'It is in the living room', 'It is at the porch']",I was playing darts last night and can't recall where I left the board. A) It is in the bedroom B) It is in the dining room C) It is in the living room D) It is at the porch. Answer:,D,existence
00245-741Fdj7NLF9,0,Can you check if I left the lamps on in the bedroom with gray bedding?,"['(Do not choose this option)', 'Yes', '(Do not choose this option)', 'No']",Can you check if I left the lamps on in the bedroom with gray bedding? A) (Do not choose this option) B) Yes C) (Do not choose this option) D) No. Answer:,D,count
00246-mscxX4KEBcB,0,Which fruit is at the top of the fruit bowl?,"['Apples', 'Grapes', 'Bananas', 'Pears']",Which fruit is at the top of the fruit bowl? A) Apples B) Grapes C) Bananas D) Pears. Answer:,C,location
00248-PM558qFsyi8,0,Is the television in the bedroom still on?,"['It is on', '(Do not choose this option)', '(Do not choose this option)', 'It is off']",Is the television in the bedroom still on? A) It is on B) (Do not choose this option) C) (Do not choose this option) D) It is off. Answer:,A,state
00256-92vYG1q49FY,0,Is the air conditioning at the entrance turned off?,"['It is off', '(Do not choose this option)', 'It is on', '(Do not choose this option)']",Is the air conditioning at the entrance turned off? A) It is off B) (Do not choose this option) C) It is on D) (Do not choose this option). Answer:,A,identification
00257-j2DKmTV5TPV,0,I want to take a shower. Is there shampoo in the shower?,"['No', 'Yes', '(Do not choose this option)', '(Do not choose this option)']",I want to take a shower. Is there shampoo in the shower? A) No B) Yes C) (Do not choose this option) D) (Do not choose this option). Answer:,B,state
