scene,floor,question,choices,question_formatted,answer,label
00258-2Pc8W48bu21,0,I want to take a shower. Is there shampoo in the shower?,"['(Do not choose this option)', 'Yes', 'No', '(Do not choose this option)']",I want to take a shower. Is there shampoo in the shower? A) (Do not choose this option) B) Yes C) No D) (Do not choose this option). Answer:,C,state
00258-2Pc8W48bu21,1,I need to retrieve my pool cues. How many are on the pool table?,"['Four', 'Three', 'Two', 'One']",I need to retrieve my pool cues. How many are on the pool table? A) Four B) Three C) Two D) One. Answer:,B,existence
00258-2Pc8W48bu21,1,Which channel is being shown on the TV?,"['Sports', 'News', 'Drama', 'It is not on']",Which channel is being shown on the TV? A) Sports B) News C) Drama D) It is not on. Answer:,A,existence
00259-4J8N2Ah1a6o,0,Is there anything left on the white chair next to TV?,"['Jacket', 'Backpack', 'Laptop', '(Do not choose this option)']",Is there anything left on the white chair next to TV? A) Jacket B) Backpack C) Laptop D) (Do not choose this option). Answer:,D,count
00262-1xGrZPxG1Hz,0,Is the wooden chair left in a room?,"['Yes, bedroom', 'Yes, dining room', 'Yes, living room', 'No']","Is the wooden chair left in a room? A) Yes, bedroom B) Yes, dining room C) Yes, living room D) No. Answer:",A,identification
00262-1xGrZPxG1Hz,1,Are the candles by the entrace put out?,"['Yes, they are out', 'No, the flame still on', '(Do not choose this option)', '(Do not choose this option)']","Are the candles by the entrace put out? A) Yes, they are out B) No, the flame still on C) (Do not choose this option) D) (Do not choose this option). Answer:",A,existence
00268-mHJxL9jnCox,0,How many bookshelves are in the room with the piano?,"['None', 'Four', 'Six', 'Two']",How many bookshelves are in the room with the piano? A) None B) Four C) Six D) Two. Answer:,B,location
00268-mHJxL9jnCox,0,I'm trying to remember where I placed the wall clock. Is it to the left or right of the fireplace?,"['Straight above', '(Do not choose this option)', 'Left', 'Right']",I'm trying to remember where I placed the wall clock. Is it to the left or right of the fireplace? A) Straight above B) (Do not choose this option) C) Left D) Right. Answer:,C,state
00268-mHJxL9jnCox,1,Do we still have some paper towel?,"['No', 'Yes, on the sofa', 'Yes, on the dining table', 'Yes, in the kitchen']","Do we still have some paper towel? A) No B) Yes, on the sofa C) Yes, on the dining table D) Yes, in the kitchen. Answer:",D,count
00273-8DDKELpgD99,0,Are the decorative candles on the mantelpiece above the fireplace?,"['(Do not choose this option)', 'Yes', 'No', '(Do not choose this option)']",Are the decorative candles on the mantelpiece above the fireplace? A) (Do not choose this option) B) Yes C) No D) (Do not choose this option). Answer:,B,state
00273-8DDKELpgD99,0,I need to replace the rugs. Which one is at the entrance door?,"['Gray', 'Red', 'Wood', 'Brown']",I need to replace the rugs. Which one is at the entrance door? A) Gray B) Red C) Wood D) Brown. Answer:,A,location
00273-8DDKELpgD99,1,I need to retrieve my lock box. Where did I leave it?,"['On the desk in the hallway', 'On the blue chest in the living room', 'On the dresser in the bedroom', 'On the kitchen counter']",I need to retrieve my lock box. Where did I leave it? A) On the desk in the hallway B) On the blue chest in the living room C) On the dresser in the bedroom D) On the kitchen counter. Answer:,B,existence
00275-4dbCzNN5L5t,0,"Is the ""Happy Birthday"" balloon still floating in the room with the toy car?","['Yes', '(Do not choose this option)', 'No', '(Do not choose this option)']","Is the ""Happy Birthday"" balloon still floating in the room with the toy car? A) Yes B) (Do not choose this option) C) No D) (Do not choose this option). Answer:",A,identification
00275-4dbCzNN5L5t,0,A guest is coming; are there pillows on the guest bed?,"['There are a bunch of them', 'There are two', 'There is one', 'There is none']",A guest is coming; are there pillows on the guest bed? A) There are a bunch of them B) There are two C) There is one D) There is none. Answer:,D,location
00280-FgswoxWb3uN,1,I might forget to close the bathroom door inside the bedroom.,"['It is open', '(Do not choose this option)', 'It is closed', '(Do not choose this option)']",I might forget to close the bathroom door inside the bedroom. A) It is open B) (Do not choose this option) C) It is closed D) (Do not choose this option). Answer:,A,state
00281-mj5sKX44BmS,0,Is there still any soap at the bathroom sink?,"['Yes', 'No', '(Do not choose this option)', '(Do not choose this option)']",Is there still any soap at the bathroom sink? A) Yes B) No C) (Do not choose this option) D) (Do not choose this option). Answer:,B,existence
00282-8nSVqHLMRwQ,0,I'm trying to remember where I placed the wooden chalkboard.,"['In the office on the desk', 'In the living room near the sofa', 'In the hallway by the entrance', 'In the kitchen near the oven']",I'm trying to remember where I placed the wooden chalkboard. A) In the office on the desk B) In the living room near the sofa C) In the hallway by the entrance D) In the kitchen near the oven. Answer:,D,state
00282-8nSVqHLMRwQ,0,Which soccer balls did I put in the kid's room?,"['Orange ones', 'Red ones', 'Blue ones', 'White ones']",Which soccer balls did I put in the kid's room? A) Orange ones B) Red ones C) Blue ones D) White ones. Answer:,A,existence
00285-QKGMrurUVbk,0,Where did I leave the big bag of Bounty paper towel?,"['It is next to bed', 'It is in the bathroom', 'It is in the kitchen', 'It is next to TV']",Where did I leave the big bag of Bounty paper towel? A) It is next to bed B) It is in the bathroom C) It is in the kitchen D) It is next to TV. Answer:,B,location
00285-QKGMrurUVbk,0,Where is the TV box installed?,"['Next to the dining table', 'In the bedroom', 'In the living room against the wall', 'In the storage room']",Where is the TV box installed? A) Next to the dining table B) In the bedroom C) In the living room against the wall D) In the storage room. Answer:,C,identification
00290-6HMiy15cxis,0,Is the piano lid put down?,"['(Do not choose this option)', 'Yes, it is down', '(Do not choose this option)', 'No, it is up']","Is the piano lid put down? A) (Do not choose this option) B) Yes, it is down C) (Do not choose this option) D) No, it is up. Answer:",B,location
00292-reHtN7VMWkg,0,Is the ceiling fan light in the porch off?,"['No, it is on', '(Do not choose this option)', 'Yes, it is off', '(Do not choose this option)']","Is the ceiling fan light in the porch off? A) No, it is on B) (Do not choose this option) C) Yes, it is off D) (Do not choose this option). Answer:",C,location
00292-reHtN7VMWkg,0,Are the black shades in the bedroom pulled down?,"['No, they are up', '(Do not choose this option)', '(Do not choose this option)', 'Yes, they are down']","Are the black shades in the bedroom pulled down? A) No, they are up B) (Do not choose this option) C) (Do not choose this option) D) Yes, they are down. Answer:",A,state
00297-jGdNyKqGZJw,0,I'm trying to remember where I placed my laptop. Is it on the outdoor table?,"['(Do not choose this option)', 'No', '(Do not choose this option)', 'Yes']",I'm trying to remember where I placed my laptop. Is it on the outdoor table? A) (Do not choose this option) B) No C) (Do not choose this option) D) Yes. Answer:,B,state
00299-bdp1XNEdvmW,0,How many sports balls are stored on the rack in the hallway?,"['Two', 'Five', 'Three', 'Four']",How many sports balls are stored on the rack in the hallway? A) Two B) Five C) Three D) Four. Answer:,C,existence
00299-bdp1XNEdvmW,0,Are the monitors left on?,"['No, they are both off', 'Yes, one of them is on', '(Do not choose this option)', 'Yes, both of them are on']","Are the monitors left on? A) No, they are both off B) Yes, one of them is on C) (Do not choose this option) D) Yes, both of them are on. Answer:",B,count
00299-bdp1XNEdvmW,1,Is there any vegetable left on the cutting board?,"['Potatoes', 'Lettuces', 'Some tomatos', 'None']",Is there any vegetable left on the cutting board? A) Potatoes B) Lettuces C) Some tomatos D) None. Answer:,D,state
00301-JiHGQpwKUvd,0,How many bar stools are there at the kitchen counter?,"['One', 'Four', 'Three', 'Two']",How many bar stools are there at the kitchen counter? A) One B) Four C) Three D) Two. Answer:,C,existence
00302-JFgrz9MNz4b,0,I'm trying to find the dartboard for our game night.,"['In the living room', 'In the dining room', 'In the bedroom', 'In the workout room']",I'm trying to find the dartboard for our game night. A) In the living room B) In the dining room C) In the bedroom D) In the workout room. Answer:,A,count
00302-JFgrz9MNz4b,1,What is left on the chair next to the piano?,"['Potatoes', 'Nothing', 'Jacket', 'Toy']",What is left on the chair next to the piano? A) Potatoes B) Nothing C) Jacket D) Toy. Answer:,B,location
00302-JFgrz9MNz4b,2,Which pillow is left on the lower bunker bed?,"['Black one', 'Green one', 'White one', 'Yellow one']",Which pillow is left on the lower bunker bed? A) Black one B) Green one C) White one D) Yellow one. Answer:,B,identification
00303-ghWQ5kHV97i,0,Does the kitchen island have any bar stools for seating?,"['Two stools', 'No stools', 'Three stools', 'One stool']",Does the kitchen island have any bar stools for seating? A) Two stools B) No stools C) Three stools D) One stool. Answer:,C,identification
00303-ghWQ5kHV97i,0,Is the bedroom wardrobe door closed?,"['No', '(Do not choose this option)', 'Yes', '(Do not choose this option)']",Is the bedroom wardrobe door closed? A) No B) (Do not choose this option) C) Yes D) (Do not choose this option). Answer:,A,existence
00304-X6Pct1msZv5,0,Is the air conditioning in the bedroom with flower painting turned on?,"['(Do not choose this option)', 'Yes, it is on', '(Do not choose this option)', 'No, it is off']","Is the air conditioning in the bedroom with flower painting turned on? A) (Do not choose this option) B) Yes, it is on C) (Do not choose this option) D) No, it is off. Answer:",B,state
00306-Y4L8fjz2yH7,0,Is there any shampoo in the shower already?,"['(Do not choose this option)', '(Do not choose this option)', 'No', 'Yes']",Is there any shampoo in the shower already? A) (Do not choose this option) B) (Do not choose this option) C) No D) Yes. Answer:,D,state
00306-Y4L8fjz2yH7,0,Where is the standing mirror?,"['In the hallway', 'In the bedroom', 'Next to TV', 'Near the entrance door']",Where is the standing mirror? A) In the hallway B) In the bedroom C) Next to TV D) Near the entrance door. Answer:,B,existence
00306-Y4L8fjz2yH7,1,I am trying to find some cloth hangers.,"['In the bathroom', 'On the bookshelf', 'On the bed', 'By the digital piano']",I am trying to find some cloth hangers. A) In the bathroom B) On the bookshelf C) On the bed D) By the digital piano. Answer:,D,location
00310-WnvnMQh4eEa,0,I need to find the large woven basket. Where did I leave it last?,"['In the corner of bathroom', 'By the bookshelf', 'Next to bed', 'Under the small white desk']",I need to find the large woven basket. Where did I leave it last? A) In the corner of bathroom B) By the bookshelf C) Next to bed D) Under the small white desk. Answer:,B,location
00313-PE6kVEtrxtj,0,I am looking for the stack of magazines I left somewhere in the living room.,"['On the red chair', 'On the coffee table', 'Under the TV', 'On the dining table']",I am looking for the stack of magazines I left somewhere in the living room. A) On the red chair B) On the coffee table C) Under the TV D) On the dining table. Answer:,C,location
00315-We1N7vBtyGm,0,I'm trying to remember where I placed the portable air purifier.,"['In the storage room near the window', 'Near the window with green curtains', 'In the room with the checkered floor', 'Next to the wood-burning stove']",I'm trying to remember where I placed the portable air purifier. A) In the storage room near the window B) Near the window with green curtains C) In the room with the checkered floor D) Next to the wood-burning stove. Answer:,A,location
00315-We1N7vBtyGm,1,Is there already some shampoo in the shower?,"['(Do not choose this option)', 'Yes', '(Do not choose this option)', 'No']",Is there already some shampoo in the shower? A) (Do not choose this option) B) Yes C) (Do not choose this option) D) No. Answer:,B,location
00323-yHLr6bvWsVm,0,Does the dining table have any fruit bowl on it?,"['(Do not choose this option)', '(Do not choose this option)', 'No', 'Yes']",Does the dining table have any fruit bowl on it? A) (Do not choose this option) B) (Do not choose this option) C) No D) Yes. Answer:,C,existence
00324-DoSbsoo4EAg,0,Is there already some shampoo at the shower?,"['No', 'Yes', '(Do not choose this option)', '(Do not choose this option)']",Is there already some shampoo at the shower? A) No B) Yes C) (Do not choose this option) D) (Do not choose this option). Answer:,A,existence
00326-u9rPN5cHWBg,0,Are the bedroom lamps on?,"['(Do not choose this option)', 'No, they are off', 'Yes, they are on', '(Do not choose this option)']","Are the bedroom lamps on? A) (Do not choose this option) B) No, they are off C) Yes, they are on D) (Do not choose this option). Answer:",C,existence
00327-xgLmjqzoAzF,0,Where did I leave the black suitcases?,"['In the laundry room', 'In the bedroom', 'In the living room', 'In the hallway closet']",Where did I leave the black suitcases? A) In the laundry room B) In the bedroom C) In the living room D) In the hallway closet. Answer:,D,state
00327-xgLmjqzoAzF,0,I was playing pool with friends. Are the balls put away from the table?,"['(Do not choose this option)', '(Do not choose this option)', 'No', 'Yes']",I was playing pool with friends. Are the balls put away from the table? A) (Do not choose this option) B) (Do not choose this option) C) No D) Yes. Answer:,D,location
00330-WhNyDTnd9g5,0,Are the pillows left on the porch chair?,"['Yes', 'No', '(Do not choose this option)', '(Do not choose this option)']",Are the pillows left on the porch chair? A) Yes B) No C) (Do not choose this option) D) (Do not choose this option). Answer:,A,state
00330-WhNyDTnd9g5,2,Is the curtain shade pulled down in the kid's room?,"['Yes, it is down', 'No, it is up', '(Do not choose this option)', '(Do not choose this option)']","Is the curtain shade pulled down in the kid's room? A) Yes, it is down B) No, it is up C) (Do not choose this option) D) (Do not choose this option). Answer:",A,existence
00331-gGMMut83nsX,0,IHow many bar stools are at the kitchen counter?,"['Five', 'Four', 'Three', 'Two']",IHow many bar stools are at the kitchen counter? A) Five B) Four C) Three D) Two. Answer:,C,state
00331-gGMMut83nsX,0,Is the air conditioning in the dining space still on?,"['(Do not choose this option)', 'No, it is off', '(Do not choose this option)', 'Yes, it is still on']","Is the air conditioning in the dining space still on? A) (Do not choose this option) B) No, it is off C) (Do not choose this option) D) Yes, it is still on. Answer:",D,count
00333-LLecyBe5Eq2,0,Can you find me the air purifier?,"['Next to sofa', 'Next to dining table', 'In the bedroom', 'In the bathroom']",Can you find me the air purifier? A) Next to sofa B) Next to dining table C) In the bedroom D) In the bathroom. Answer:,B,state
00333-LLecyBe5Eq2,1,I'm trying to remember where I placed my decorative pine cone.,"['On the bedstand', 'Next to TV in the living space', 'On the bathroom sink', 'On the small desk in the dining space']",I'm trying to remember where I placed my decorative pine cone. A) On the bedstand B) Next to TV in the living space C) On the bathroom sink D) On the small desk in the dining space. Answer:,D,location
00333-LLecyBe5Eq2,1,Which towel is next to the bathrub?,"['White', 'Blue', 'Brown', 'Gray']",Which towel is next to the bathrub? A) White B) Blue C) Brown D) Gray. Answer:,D,location
00339-T7nCRmufFNR,0,Which blanket is on the bed next to the office desk?,"['Blue', 'Black', 'White', 'Orange']",Which blanket is on the bed next to the office desk? A) Blue B) Black C) White D) Orange. Answer:,A,identification
00342-C6JvMamYTRg,0,I am looking for my black-white checkered blancket.,"['On the bed', 'On the big armchair', 'In the bathroom', 'On the large sofa']",I am looking for my black-white checkered blancket. A) On the bed B) On the big armchair C) In the bathroom D) On the large sofa. Answer:,B,identification
00343-5graSmdK3Bj,0,How many additional chairs are there next to the dining table against the wall?,"['Three', 'One', 'Two', 'None']",How many additional chairs are there next to the dining table against the wall? A) Three B) One C) Two D) None. Answer:,C,location
00347-bwoBmU23M2N,0,I'm trying to remember where I placed the cat's scratching post.,"['In the garage', 'In the living room', 'In the bedroom', 'In the entryway']",I'm trying to remember where I placed the cat's scratching post. A) In the garage B) In the living room C) In the bedroom D) In the entryway. Answer:,D,count
00347-bwoBmU23M2N,1,Which fruit is there at the top of fruit bowl?,"['Banana', 'Apple', 'Orange', 'Grapes']",Which fruit is there at the top of fruit bowl? A) Banana B) Apple C) Orange D) Grapes. Answer:,A,location
00349-p32JzpQyhPk,0,Is there any pot left on the stove?,"['There is one', 'There is none', 'There are two', 'There are three']",Is there any pot left on the stove? A) There is one B) There is none C) There are two D) There are three. Answer:,A,identification
00349-p32JzpQyhPk,1,I was doing some cleaning and can't recall where I left the waste bin. Where is it?,"['In the living room', 'In the hallway', 'At the bed foot', 'In the office']",I was doing some cleaning and can't recall where I left the waste bin. Where is it? A) In the living room B) In the hallway C) At the bed foot D) In the office. Answer:,D,existence
00353-8qbZhbTc1wX,0,Which rug did I leave at the bathtub?,"['Gray one', 'White one', 'Blue one', 'Black one']",Which rug did I leave at the bathtub? A) Gray one B) White one C) Blue one D) Black one. Answer:,A,location
00354-NpCFg9NdUgL,1,I am expecting a package. Is there one by the entrance door?,"['(Do not choose this option)', 'No', 'Yes', '(Do not choose this option)']",I am expecting a package. Is there one by the entrance door? A) (Do not choose this option) B) No C) Yes D) (Do not choose this option). Answer:,C,identification
00356-RYzud5W7ZnC,0,I am looking for my briefcase. Is is on my office desk?,"['Yes', '(Do not choose this option)', '(Do not choose this option)', 'No']",I am looking for my briefcase. Is is on my office desk? A) Yes B) (Do not choose this option) C) (Do not choose this option) D) No. Answer:,D,existence
00356-RYzud5W7ZnC,0,What color is the office desk chair?,"['Red', 'White', 'Green', 'Black']",What color is the office desk chair? A) Red B) White C) Green D) Black. Answer:,C,existence
00357-TzQLNfWugiZ,0,I want to unplug the window air conditioning unit but not sure if I did.,"['Yes, it is unplugged', '(Do not choose this option)', '(Do not choose this option)', 'No, it is still plugged in']","I want to unplug the window air conditioning unit but not sure if I did. A) Yes, it is unplugged B) (Do not choose this option) C) (Do not choose this option) D) No, it is still plugged in. Answer:",D,state
00359-aTf5zsbjZMb,0,Which rug is there on the kitchen floor right now?,"['Black one', 'Brown one', 'Gray one', 'Blue one']",Which rug is there on the kitchen floor right now? A) Black one B) Brown one C) Gray one D) Blue one. Answer:,C,identification
00359-aTf5zsbjZMb,0,Guest is coming. Is there any hand towel in the bathroom?,"['(Do not choose this option)', 'Yes', 'No', '(Do not choose this option)']",Guest is coming. Is there any hand towel in the bathroom? A) (Do not choose this option) B) Yes C) No D) (Do not choose this option). Answer:,B,existence
00359-aTf5zsbjZMb,1,Is there any white paper on the printer?,"['Yes', '(Do not choose this option)', 'No', '(Do not choose this option)']",Is there any white paper on the printer? A) Yes B) (Do not choose this option) C) No D) (Do not choose this option). Answer:,A,existence
00360-yA3RqPqMrGE,0,Is the piano lid down?,"['(Do not choose this option)', 'Yes, it is down', 'No, it is up still', '(Do not choose this option)']","Is the piano lid down? A) (Do not choose this option) B) Yes, it is down C) No, it is up still D) (Do not choose this option). Answer:",B,state
00360-yA3RqPqMrGE,0,How many chairs we have at dining table?,"['Three', 'Four', 'One', 'Two']",How many chairs we have at dining table? A) Three B) Four C) One D) Two. Answer:,B,count
00362-o94q92w5PK5,0,I want to make sure I left the red kitchen mat in place.,"['It is in front of dishwasher', 'It is in front of sink', 'It is in front of refrigerator', 'It is in front of kitchen island']",I want to make sure I left the red kitchen mat in place. A) It is in front of dishwasher B) It is in front of sink C) It is in front of refrigerator D) It is in front of kitchen island. Answer:,C,existence
00362-o94q92w5PK5,0,Is the living room TV turned off?,"['Yes, it is off', 'No, it is still on', '(Do not choose this option)', '(Do not choose this option)']","Is the living room TV turned off? A) Yes, it is off B) No, it is still on C) (Do not choose this option) D) (Do not choose this option). Answer:",A,state
00364-tEafuWwhhwr,0,What did I leave at the corner of the kitchen countertop?,"['Rice cooker', 'Mixer', 'Pot', 'Microwave']",What did I leave at the corner of the kitchen countertop? A) Rice cooker B) Mixer C) Pot D) Microwave. Answer:,B,identification
00364-tEafuWwhhwr,0,Which pillow is on the green chair on the porch?,"['Blue', 'Red', 'White', 'Yellow']",Which pillow is on the green chair on the porch? A) Blue B) Red C) White D) Yellow. Answer:,A,identification
00364-tEafuWwhhwr,1,I'm looking for my pair of brown shoes. Are they under the armchair in the bedroom?,"['Yes, they are under the armchair.', '(Do not choose this option)', 'No, they are not under the armchair.', '(Do not choose this option)']","I'm looking for my pair of brown shoes. Are they under the armchair in the bedroom? A) Yes, they are under the armchair. B) (Do not choose this option) C) No, they are not under the armchair. D) (Do not choose this option). Answer:",C,existence
00366-fxbzYAGkrtm,0,I am looking for my boots. Are they on the stairs by the entrance door?,"['(Do not choose this option)', 'No', '(Do not choose this option)', 'Yes']",I am looking for my boots. Are they on the stairs by the entrance door? A) (Do not choose this option) B) No C) (Do not choose this option) D) Yes. Answer:,B,existence
00366-fxbzYAGkrtm,1,How many pillows I put on the bed with red bedding?,"['None', 'Two', 'One', 'Four']",How many pillows I put on the bed with red bedding? A) None B) Two C) One D) Four. Answer:,A,count
00368-k9UfRPqLm3j,0,Is the patio door open?,"['(Do not choose this option)', 'No', 'Yes', '(Do not choose this option)']",Is the patio door open? A) (Do not choose this option) B) No C) Yes D) (Do not choose this option). Answer:,C,state
00368-k9UfRPqLm3j,1,Is the shower curtain on or off?,"['(Do not choose this option)', 'On', '(Do not choose this option)', 'Off']",Is the shower curtain on or off? A) (Do not choose this option) B) On C) (Do not choose this option) D) Off. Answer:,B,state
00369-FgXPKxNp5kK,0,Did I leave any pot on the stove?,"['(Do not choose this option)', 'Yes', '(Do not choose this option)', 'No']",Did I leave any pot on the stove? A) (Do not choose this option) B) Yes C) (Do not choose this option) D) No. Answer:,D,existence
00369-FgXPKxNp5kK,1,Is there stuff to be cleaned up from the kitchen floor?,"['(Do not choose this option)', 'Yes', 'No', '(Do not choose this option)']",Is there stuff to be cleaned up from the kitchen floor? A) (Do not choose this option) B) Yes C) No D) (Do not choose this option). Answer:,B,existence
00371-6AGcGQf2wof,0,Which pillows are on the bed?,"['Gray', 'White', 'Blue', 'Black']",Which pillows are on the bed? A) Gray B) White C) Blue D) Black. Answer:,B,identification
00373-WPzCkWEorzk,0,What did I leave on the eye-shaped coffee table?,"['Purse', 'Books', 'Mug', 'Nothing']",What did I leave on the eye-shaped coffee table? A) Purse B) Books C) Mug D) Nothing. Answer:,D,identification
00376-wxixLWuvLjd,0,I'm trying to remember where I placed the decorative star. It is on the shelf next to the television?,"['No', '(Do not choose this option)', 'Yes', '(Do not choose this option)']",I'm trying to remember where I placed the decorative star. It is on the shelf next to the television? A) No B) (Do not choose this option) C) Yes D) (Do not choose this option). Answer:,A,existence
00376-wxixLWuvLjd,0,Is the black recliner chair positioned facing the window?,"['Yes', 'No', '(Do not choose this option)', '(Do not choose this option)']",Is the black recliner chair positioned facing the window? A) Yes B) No C) (Do not choose this option) D) (Do not choose this option). Answer:,A,state
00376-wxixLWuvLjd,0,Is the fruit bowl left on the kitchen countertop?,"['(Do not choose this option)', 'Yes', 'No', '(Do not choose this option)']",Is the fruit bowl left on the kitchen countertop? A) (Do not choose this option) B) Yes C) No D) (Do not choose this option). Answer:,C,existence
00377-Fgtk7tL8R9Y,0,Where is the yellow bean bag sofa?,"['In the storage room', 'In front of bathroom', 'In the kitchen', 'Under the TV']",Where is the yellow bean bag sofa? A) In the storage room B) In front of bathroom C) In the kitchen D) Under the TV. Answer:,D,location
