scene,floor,question,choices,question_formatted,answer,label
00004-VqCaAuuoeWk,1,Is the lamp next to the bed on?,"['(Do not choose this option)', 'Yes, it is on', 'No, it is not on', '(Do not choose this option)']","Is the lamp next to the bed on? A) (Do not choose this option) B) Yes, it is on C) No, it is not on D) (Do not choose this option). Answer:",B,existence
00005-yPKGKBCyYx8,0,Is the outdoor grill covered?,"['(Do not choose this option)', 'Yes', '(Do not choose this option)', 'No']",Is the outdoor grill covered? A) (Do not choose this option) B) Yes C) (Do not choose this option) D) No. Answer:,B,count
00005-yPKGKBCyYx8,0,"Which rug is at the shower in the bathroom, one in the bedroom?","['Dark blue', 'Black', 'Gray', 'White']","Which rug is at the shower in the bathroom, one in the bedroom? A) Dark blue B) Black C) Gray D) White. Answer:",C,state
00006-HkseAnWCgqk,0,Did I fold the blanket on the bed in the bedroom?,"['(Do not choose this option)', 'No', 'Yes', '(Do not choose this option)']",Did I fold the blanket on the bed in the bedroom? A) (Do not choose this option) B) No C) Yes D) (Do not choose this option). Answer:,B,identification
00006-HkseAnWCgqk,1,Is the living room light on?,"['(Do not choose this option)', '(Do not choose this option)', 'No', 'Yes']",Is the living room light on? A) (Do not choose this option) B) (Do not choose this option) C) No D) Yes. Answer:,D,existence
00010-DBjEcHFg4oq,0,Is the lamp next to the sofa turned on or off?,"['(Do not choose this option)', 'Off', 'On', '(Do not choose this option)']",Is the lamp next to the sofa turned on or off? A) (Do not choose this option) B) Off C) On D) (Do not choose this option). Answer:,C,count
00013-sfbj7jspYWj,0,Where is the ladder?,"['By the dining table', 'Next to the living room dressor', 'In the bathroom', 'Next to TV']",Where is the ladder? A) By the dining table B) Next to the living room dressor C) In the bathroom D) Next to TV. Answer:,B,existence
00015-LPwS1aEGXBb,0,Is there any wine left under the kitchen island?,"['(Do not choose this option)', 'Yes, there are a few', 'No, there is none', 'Yes, but there is only one left']","Is there any wine left under the kitchen island? A) (Do not choose this option) B) Yes, there are a few C) No, there is none D) Yes, but there is only one left. Answer:",B,state
00015-LPwS1aEGXBb,1,Where did I leave the small gray bench?,"['In the kitchen', 'In the living room', 'In the bathroom', 'In the bedroom']",Where did I leave the small gray bench? A) In the kitchen B) In the living room C) In the bathroom D) In the bedroom. Answer:,C,identification
00015-LPwS1aEGXBb,1,Is the hallway mirror is mounted on the wall or standing on the floor?,"['Mounted on the wall', '(Do not choose this option)', 'Standing on the floor', '(Do not choose this option)']",Is the hallway mirror is mounted on the wall or standing on the floor? A) Mounted on the wall B) (Do not choose this option) C) Standing on the floor D) (Do not choose this option). Answer:,C,state
00023-zepmXAdrpjR,1,Is the kettle on the kitchen counter?,"['(Do not choose this option)', 'Yes', 'No', '(Do not choose this option)']",Is the kettle on the kitchen counter? A) (Do not choose this option) B) Yes C) No D) (Do not choose this option). Answer:,B,existence
00023-zepmXAdrpjR,1,Where did I leave the silver trash can at,"['Next to the dining table', 'Next to the TV', 'Next to the kitchen sink', 'Next to the refrigerator']",Where did I leave the silver trash can at A) Next to the dining table B) Next to the TV C) Next to the kitchen sink D) Next to the refrigerator. Answer:,D,count
00025-ixTj1aTMup2,0,How many bedside tables are there in the bedroom with the white bedding?,"['Three', 'One', 'None', 'Two']",How many bedside tables are there in the bedroom with the white bedding? A) Three B) One C) None D) Two. Answer:,D,state
00025-ixTj1aTMup2,0,Is the gray curtain pulled down in the bedroom with two twin beds?,"['(Do not choose this option)', 'Yes, it is down', 'No, it is up', '(Do not choose this option)']","Is the gray curtain pulled down in the bedroom with two twin beds? A) (Do not choose this option) B) Yes, it is down C) No, it is up D) (Do not choose this option). Answer:",B,count
00025-ixTj1aTMup2,1,Where did I leave the standing fan at? I moved it last week.,"['In the bathroom', 'In the kitchen', 'Next to the TV', 'In the living room']",Where did I leave the standing fan at? I moved it last week. A) In the bathroom B) In the kitchen C) Next to the TV D) In the living room. Answer:,D,count
00025-ixTj1aTMup2,1,Did I leave the fruit bowl next to the microwave?,"['Next to the TV', 'Yes', 'In the bathroom', 'No']",Did I leave the fruit bowl next to the microwave? A) Next to the TV B) Yes C) In the bathroom D) No. Answer:,D,existence
00031-Wo6kuutE9i7,0,Did I leave the blue decorative pillow on one of the living room sofas?,"['On the sofa closer to the clock', 'On neither sofa', 'On the sofa closer to the painting', 'On both sofas']",Did I leave the blue decorative pillow on one of the living room sofas? A) On the sofa closer to the clock B) On neither sofa C) On the sofa closer to the painting D) On both sofas. Answer:,C,count
00033-oPj9qMxrDEa,0,Did you see the woven basket anywhere?,"['By the kitchen counter', 'Between TV and living room sofas', 'Next to the dining table', 'Next to the living room armchairs']",Did you see the woven basket anywhere? A) By the kitchen counter B) Between TV and living room sofas C) Next to the dining table D) Next to the living room armchairs. Answer:,D,state
00033-oPj9qMxrDEa,0,Where did I leave the striped towel?,"['On the dining table', 'On the living room floor', 'In the bathroom', 'By the kitchen sink']",Where did I leave the striped towel? A) On the dining table B) On the living room floor C) In the bathroom D) By the kitchen sink. Answer:,D,state
00035-3XYAD64HpDr,0,Is the kettle on the kitchen countertop?,"['Yes', 'No', '(Do not choose this option)', '(Do not choose this option)']",Is the kettle on the kitchen countertop? A) Yes B) No C) (Do not choose this option) D) (Do not choose this option). Answer:,A,identification
00035-3XYAD64HpDr,0,Are there more than twenty books by the window next to the dining table?,"['(Do not choose this option)', '(Do not choose this option)', 'No', 'Yes']",Are there more than twenty books by the window next to the dining table? A) (Do not choose this option) B) (Do not choose this option) C) No D) Yes. Answer:,C,state
00036-41FNXLAZZgC,0,I forgot where I hung the clock. Do you see it?,"['It is above the kitchen cabinets', 'It is above the dining table', 'It is above the bed', 'It is above the TV']",I forgot where I hung the clock. Do you see it? A) It is above the kitchen cabinets B) It is above the dining table C) It is above the bed D) It is above the TV. Answer:,A,state
00036-41FNXLAZZgC,0,Is my kid on the treadmill?,"['(Do not choose this option)', '(Do not choose this option)', 'No', 'Yes']",Is my kid on the treadmill? A) (Do not choose this option) B) (Do not choose this option) C) No D) Yes. Answer:,C,identification
00037-oKFJo8jpzRW,0,Is there a cushion on the wicker chair in the room with the green walls?,"['Yes', '(Do not choose this option)', '(Do not choose this option)', 'No']",Is there a cushion on the wicker chair in the room with the green walls? A) Yes B) (Do not choose this option) C) (Do not choose this option) D) No. Answer:,A,state
00037-oKFJo8jpzRW,0,"I remember leaving some books in one of the rooms, on wooden shelves.","['(Do not choose this option)', 'In the room with white wall', 'In the room with green wall', 'In the room with orange wall']","I remember leaving some books in one of the rooms, on wooden shelves. A) (Do not choose this option) B) In the room with white wall C) In the room with green wall D) In the room with orange wall. Answer:",C,state
00037-oKFJo8jpzRW,1,I am going to shower now. I need to grab some towels.,"['There are none in the bathroom', 'There is only one in the bathroom', 'There are already some in the bathroom', 'There are some in the bedroom']",I am going to shower now. I need to grab some towels. A) There are none in the bathroom B) There is only one in the bathroom C) There are already some in the bathroom D) There are some in the bedroom. Answer:,C,state
00048-aKwZ7VJDAjr,0,Did I leave the lamp next to the dresser mirror on?,"['(Do not choose this option)', '(Do not choose this option)', 'Yes, it is on', 'No, it is off']","Did I leave the lamp next to the dresser mirror on? A) (Do not choose this option) B) (Do not choose this option) C) Yes, it is on D) No, it is off. Answer:",C,location
00051-CETmJJqkhcK,0,I'm trying to remember where I placed the blue figurine. Is it on top of any dresser in the house?,"['On the white dresser', 'On the wooden dresser', 'On the gray dresser', 'On the black dresser']",I'm trying to remember where I placed the blue figurine. Is it on top of any dresser in the house? A) On the white dresser B) On the wooden dresser C) On the gray dresser D) On the black dresser. Answer:,B,existence
00051-CETmJJqkhcK,0,How many red pillows did I leave on the living room sofa?,"['One', 'Three', 'None', 'Two']",How many red pillows did I leave on the living room sofa? A) One B) Three C) None D) Two. Answer:,D,location
00052-H1D2FZ8TAv1,0,I forgot where the thermostat is.,"['By the TV', 'Next to kitchen counter', 'Next to the entrance door', 'Next to the refrigerator']",I forgot where the thermostat is. A) By the TV B) Next to kitchen counter C) Next to the entrance door D) Next to the refrigerator. Answer:,C,state
00052-H1D2FZ8TAv1,2,Is there a bottle of shampoo inside the glass shower already?,"['(Do not choose this option)', 'No', 'Yes', '(Do not choose this option)']",Is there a bottle of shampoo inside the glass shower already? A) (Do not choose this option) B) No C) Yes D) (Do not choose this option). Answer:,C,existence
00056-kdw2Uapns3b,0,Did I leave the exercise mat under any workout equipment?,"['Yes, under the elliptical machine', 'Yes, under the stationary bike', ""No, it's not under any workout equipment"", 'Yes, under the treadmill']","Did I leave the exercise mat under any workout equipment? A) Yes, under the elliptical machine B) Yes, under the stationary bike C) No, it's not under any workout equipment D) Yes, under the treadmill. Answer:",D,location
00056-kdw2Uapns3b,1,How many pieces of mat I put at the entrance door?,"['One', 'None', 'Two', 'Three']",How many pieces of mat I put at the entrance door? A) One B) None C) Two D) Three. Answer:,C,count
00056-kdw2Uapns3b,1,What time is it now?,"['1-3pm', '6-8am', '9-11pm', '5-7pm']",What time is it now? A) 1-3pm B) 6-8am C) 9-11pm D) 5-7pm. Answer:,A,state
00056-kdw2Uapns3b,2,Which rug did I put at the toilet?,"['Black', 'White/Gray', 'Blue', 'Red']",Which rug did I put at the toilet? A) Black B) White/Gray C) Blue D) Red. Answer:,B,location
00056-kdw2Uapns3b,2,Is the TV in the bedroom with blue wall left turned on?,"['(Do not choose this option)', '(Do not choose this option)', 'Yes', 'No']",Is the TV in the bedroom with blue wall left turned on? A) (Do not choose this option) B) (Do not choose this option) C) Yes D) No. Answer:,D,existence
00057-1UnKg1rAb8A,0,Is the kitchen sink currently free of dishes?,"['(Do not choose this option)', '(Do not choose this option)', ""Yes, it's empty"", 'No, there are dishes']","Is the kitchen sink currently free of dishes? A) (Do not choose this option) B) (Do not choose this option) C) Yes, it's empty D) No, there are dishes. Answer:",C,location
00057-1UnKg1rAb8A,0,Is the front door is currently open or closed?,"[""It's open"", '(Do not choose this option)', 'It is half open', ""It's closed""]",Is the front door is currently open or closed? A) It's open B) (Do not choose this option) C) It is half open D) It's closed. Answer:,D,location
00057-1UnKg1rAb8A,0,Where did I place the decorative owl?,"['In the bathroom', 'On the kitchen counter', 'On the hallway wall', 'On the living room table']",Where did I place the decorative owl? A) In the bathroom B) On the kitchen counter C) On the hallway wall D) On the living room table. Answer:,C,existence
00057-1UnKg1rAb8A,1,Is there a fan somewhere?,"['Yes, it is next to the shower', 'No, there is none', 'Yes, it is next to a bed', 'Yes, it is in the kitchen']","Is there a fan somewhere? A) Yes, it is next to the shower B) No, there is none C) Yes, it is next to a bed D) Yes, it is in the kitchen. Answer:",C,existence
00057-1UnKg1rAb8A,1,I'm looking for my colorful handbag. Do you see it somewhere?,"['It is on the coffee table', 'It is on the wall', 'It is on the living room floor', 'It is next to the TV']",I'm looking for my colorful handbag. Do you see it somewhere? A) It is on the coffee table B) It is on the wall C) It is on the living room floor D) It is next to the TV. Answer:,B,location
00060-TgWKHxhJAng,0,I need to retrieve my guitar for practice - they are on the wall. Which room should I go to?,"['The room with the empty wall', 'The room with the computer desk', 'The room with the red walls', 'The room with the pool table']",I need to retrieve my guitar for practice - they are on the wall. Which room should I go to? A) The room with the empty wall B) The room with the computer desk C) The room with the red walls D) The room with the pool table. Answer:,B,existence
00060-TgWKHxhJAng,0,I played pool with friends last night. Is the pool table cleaned up?,"['No', '(Do not choose this option)', '(Do not choose this option)', 'Yes']",I played pool with friends last night. Is the pool table cleaned up? A) No B) (Do not choose this option) C) (Do not choose this option) D) Yes. Answer:,A,existence
00060-TgWKHxhJAng,1,What time is it now?,"['9-11am', '2-4pm', '5-7pm', '9-11pm']",What time is it now? A) 9-11am B) 2-4pm C) 5-7pm D) 9-11pm. Answer:,B,location
00060-TgWKHxhJAng,1,Which rug is there at the entrance door?,"['Black', 'Red', 'Gray', 'White']",Which rug is there at the entrance door? A) Black B) Red C) Gray D) White. Answer:,B,location
00060-TgWKHxhJAng,2,Did I leave the window in the home office open or closed?,"['Open', '(Do not choose this option)', 'Closed', '(Do not choose this option)']",Did I leave the window in the home office open or closed? A) Open B) (Do not choose this option) C) Closed D) (Do not choose this option). Answer:,C,state
00060-TgWKHxhJAng,2,Did I leave the laptop under the TV in the bedroom?,"['Yes', '(Do not choose this option)', '(Do not choose this option)', 'No']",Did I leave the laptop under the TV in the bedroom? A) Yes B) (Do not choose this option) C) (Do not choose this option) D) No. Answer:,D,location
00062-ACZZiU6BXLz,0,I'm trying to remember where I placed the wall clock. Where it is in the kitchen?,"['Above the sink', 'Next to the refrigerator', 'Near the stove', 'On the wall opposite the windows']",I'm trying to remember where I placed the wall clock. Where it is in the kitchen? A) Above the sink B) Next to the refrigerator C) Near the stove D) On the wall opposite the windows. Answer:,A,location
00062-ACZZiU6BXLz,0,I'm expecting guests and need to confirm the seating. How many dining chairs are around the dining table?,"['Four', 'Six', 'Eight', 'Ten']",I'm expecting guests and need to confirm the seating. How many dining chairs are around the dining table? A) Four B) Six C) Eight D) Ten. Answer:,B,existence
00062-ACZZiU6BXLz,0,Have I already put the fruit bowl on the kitchen counter?,"['No', 'There is some fruit but in a bowl', 'Yes', 'There is a bowl but no fruit']",Have I already put the fruit bowl on the kitchen counter? A) No B) There is some fruit but in a bowl C) Yes D) There is a bowl but no fruit. Answer:,A,existence
00062-ACZZiU6BXLz,1,I need to find my painting of the ocean. Where is it?,"['Master bedroom', 'Bathroom', 'Hallway', 'Guest bedroom']",I need to find my painting of the ocean. Where is it? A) Master bedroom B) Bathroom C) Hallway D) Guest bedroom. Answer:,D,count
00062-ACZZiU6BXLz,1,How many pillows did I leave on the bed with green floral bedding?,"['Three', 'One', 'None', 'Two']",How many pillows did I leave on the bed with green floral bedding? A) Three B) One C) None D) Two. Answer:,B,state
00066-nHHVbEyHX3t,0,I need to put out a fire. Where is the fire extinguisher again?,"['Next to sofa', 'In the hallway', 'Next to bed', 'Next to door to patio']",I need to put out a fire. Where is the fire extinguisher again? A) Next to sofa B) In the hallway C) Next to bed D) Next to door to patio. Answer:,D,identification
00069-Y8Y6ukxGMvn,0,Does the coffee table have any decorative items on it?,"['No, it is completely clear.', 'Yes, there are cooking utensils.', 'Yes, there is a vase.', 'Yes, there is a fruit bowl.']","Does the coffee table have any decorative items on it? A) No, it is completely clear. B) Yes, there are cooking utensils. C) Yes, there is a vase. D) Yes, there is a fruit bowl.. Answer:",C,state
00069-Y8Y6ukxGMvn,0,Is there a floor-standing mirror in the bedroom?,"['(Do not choose this option)', 'Yes, near the bed.', 'Yes, near the door.', ""No, there isn't one.""]","Is there a floor-standing mirror in the bedroom? A) (Do not choose this option) B) Yes, near the bed. C) Yes, near the door. D) No, there isn't one.. Answer:",B,state
00070-w7QyjJ3H9Bp,0,I can't remember where I left a green cooking pot. Is it in the kitchen?,"['On the stove', 'Next to the sink', ""It's not there"", 'On the counter']",I can't remember where I left a green cooking pot. Is it in the kitchen? A) On the stove B) Next to the sink C) It's not there D) On the counter. Answer:,C,location
00070-w7QyjJ3H9Bp,1,I need to retrieve a book from the shelf. Which room has the large bookshelf?,"['The room with the white curtains', 'The room with the yellow curtains', 'The room with the blue curtains', 'The room with the red curtains']",I need to retrieve a book from the shelf. Which room has the large bookshelf? A) The room with the white curtains B) The room with the yellow curtains C) The room with the blue curtains D) The room with the red curtains. Answer:,C,location
00072-t8wCA6Qe8uT,1,I'm trying to remember where I placed the fruit bowl. Where is it in the living room?,"['On the dining table', 'On the side table by the sofa', 'On the coffee table', 'On the shelf next to the TV']",I'm trying to remember where I placed the fruit bowl. Where is it in the living room? A) On the dining table B) On the side table by the sofa C) On the coffee table D) On the shelf next to the TV. Answer:,A,location
00072-t8wCA6Qe8uT,1,I recently moved the silver trash can. Do you see it anywhere?,"['In the bedroom', 'By the entrance door', 'In the living room', 'By the kitchen']",I recently moved the silver trash can. Do you see it anywhere? A) In the bedroom B) By the entrance door C) In the living room D) By the kitchen. Answer:,D,location
00074-kHvNo8x6Qoe,1,Did I leave my backpack on the table at the porch?,"['No', '(Do not choose this option)', '(Do not choose this option)', 'Yes']",Did I leave my backpack on the table at the porch? A) No B) (Do not choose this option) C) (Do not choose this option) D) Yes. Answer:,A,state
00074-kHvNo8x6Qoe,1,I'm expecting guests and I need extra seating. How many stools are available at the kitchen island?,"['One', 'Two', 'None', 'Three']",I'm expecting guests and I need extra seating. How many stools are available at the kitchen island? A) One B) Two C) None D) Three. Answer:,C,state
00081-5biL7VEkByM,0,Did the housekeeper clear the bookshelves already?,"['Yes, they are clear', 'No, they are still full of books', 'Yes, but there are a few books left', '(Do not choose this option)']","Did the housekeeper clear the bookshelves already? A) Yes, they are clear B) No, they are still full of books C) Yes, but there are a few books left D) (Do not choose this option). Answer:",A,state
00081-5biL7VEkByM,0,Did any book fall onto the floor in the hallway where the bookselves are?,"['(Do not choose this option)', '(Do not choose this option)', 'No, there is none on the floor', 'Yes, there are a few on the floor']","Did any book fall onto the floor in the hallway where the bookselves are? A) (Do not choose this option) B) (Do not choose this option) C) No, there is none on the floor D) Yes, there are a few on the floor. Answer:",C,location
00084-CtZLhCbWFm7,0,Is the air conditioning in the living room turned off?,"['Yes, it is off', '(Do not choose this option)', 'No, it is still on', '(Do not choose this option)']","Is the air conditioning in the living room turned off? A) Yes, it is off B) (Do not choose this option) C) No, it is still on D) (Do not choose this option). Answer:",C,count
00086-315QujoX279,0,I am looking for the fruit-themed towels. Where are them?,"['In the bathroom', 'In the kitchen', 'On the sofa', 'On the armchair']",I am looking for the fruit-themed towels. Where are them? A) In the bathroom B) In the kitchen C) On the sofa D) On the armchair. Answer:,B,existence
00086-315QujoX279,0,Did I leave the air conditioning in the living room on?,"['No, it is off', '(Do not choose this option)', 'Yes, it is on', '(Do not choose this option)']","Did I leave the air conditioning in the living room on? A) No, it is off B) (Do not choose this option) C) Yes, it is on D) (Do not choose this option). Answer:",A,location
00090-C8VQQtzUoqV,0,I'm trying to remember where I placed my floor lamp with the multiple light fixtures.,"['Near the bookshelf', 'In the corner by the window', 'Next to the sofa', 'By the main entrance']",I'm trying to remember where I placed my floor lamp with the multiple light fixtures. A) Near the bookshelf B) In the corner by the window C) Next to the sofa D) By the main entrance. Answer:,B,location
00090-C8VQQtzUoqV,0,I'm looking for my red and white checkered blanket. Can you see where it is?,"['Draped over the sofa', 'Laid out on the floor', 'On the bookshelf', 'On the table with the yellow cloth']",I'm looking for my red and white checkered blanket. Can you see where it is? A) Draped over the sofa B) Laid out on the floor C) On the bookshelf D) On the table with the yellow cloth. Answer:,B,existence
00094-WT4QWwXrMzs,0,Is the ironing board set up in the room with the sectional sofa?,"['Yes', 'No', '(Do not choose this option)', '(Do not choose this option)']",Is the ironing board set up in the room with the sectional sofa? A) Yes B) No C) (Do not choose this option) D) (Do not choose this option). Answer:,B,existence
00094-WT4QWwXrMzs,0,Is the gaming chair under the loft bed?,"['Yes', '(Do not choose this option)', '(Do not choose this option)', 'No']",Is the gaming chair under the loft bed? A) Yes B) (Do not choose this option) C) (Do not choose this option) D) No. Answer:,A,existence
00094-WT4QWwXrMzs,1,What is left in the basket that is under the TV?,"['Watter bottles', 'Blankets', 'Nothing', 'Fruits']",What is left in the basket that is under the TV? A) Watter bottles B) Blankets C) Nothing D) Fruits. Answer:,B,location
00094-WT4QWwXrMzs,1,Which rug is there next to the refrigerator?,"['Purple', 'Black', 'Gray', 'Blue']",Which rug is there next to the refrigerator? A) Purple B) Black C) Gray D) Blue. Answer:,C,location
00094-WT4QWwXrMzs,2,I need to find my white storage ottoman. Where is it?,"['At the end of the hallway', 'Near the bedroom chairs', 'Inside the kitchen', 'Next to the living room window']",I need to find my white storage ottoman. Where is it? A) At the end of the hallway B) Near the bedroom chairs C) Inside the kitchen D) Next to the living room window. Answer:,B,location
00094-WT4QWwXrMzs,2,Is there any clothing to be cleaned up from the floor in the bedroom?,"['Yes, there is a pair of jeans', 'No, the floor is clean', 'Yes, there is a pair of pants', 'Yes, there are some socks']","Is there any clothing to be cleaned up from the floor in the bedroom? A) Yes, there is a pair of jeans B) No, the floor is clean C) Yes, there is a pair of pants D) Yes, there are some socks. Answer:",B,existence
00100-y3K5dmhuukt,1,I'm looking for my black and white sneakers. Where are the sneaker boxes?,"['Next to the bed', 'At the bottom of wardrobe', 'In the corner of bedroom', 'At the top of wardrobe']",I'm looking for my black and white sneakers. Where are the sneaker boxes? A) Next to the bed B) At the bottom of wardrobe C) In the corner of bedroom D) At the top of wardrobe. Answer:,B,count
00100-y3K5dmhuukt,1,Does the bathtub need to be cleaned?,"['No, it looks very clean', '(Do not choose this option)', '(Do not choose this option)', 'Yes, it looks very stained']","Does the bathtub need to be cleaned? A) No, it looks very clean B) (Do not choose this option) C) (Do not choose this option) D) Yes, it looks very stained. Answer:",A,state
00106-ZVScmfktNQ1,0,Where did I put the pink toddler chair in the child's room?,"['Next to the blue cabinet', 'Next to the bed', 'Next to the window', 'Next to the black cabinet']",Where did I put the pink toddler chair in the child's room? A) Next to the blue cabinet B) Next to the bed C) Next to the window D) Next to the black cabinet. Answer:,A,state
00106-ZVScmfktNQ1,0,Is the door to the closet next to the kitchen left open?,"['(Do not choose this option)', 'Yes', '(Do not choose this option)', 'No']",Is the door to the closet next to the kitchen left open? A) (Do not choose this option) B) Yes C) (Do not choose this option) D) No. Answer:,B,location
00109-GTV2Y73Sn5t,0,I need to water the plants. How many potted plants are on the kitchen island?,"['Four', 'Two', 'Three', 'One']",I need to water the plants. How many potted plants are on the kitchen island? A) Four B) Two C) Three D) One. Answer:,D,location
